{"schema_version":"1.0","deployment_id":"LS-DEPLOYMENT-FIXTURE-DELTA-ON","environment":"STAGING","deployed_at":"2026-10-04T13:10:00Z","deployed_by":"DEPLOYER-FIXTURE","adapter_version":"0.2.0","contract_bindings":[{"artifact_path":"Listing_Suite_Integration_Contract.md","artifact_version":"1.1","sha256":"aaaaaaaaaaaaaaaaaaaaaaaaaaaaaaaaaaaaaaaaaaaaaaaaaaaaaaaaaaaaaaaa"},{"artifact_path":"listing_suite_passport_action_request.schema.json","artifact_version":"1.0","sha256":"bbbbbbbbbbbbbbbbbbbbbbbbbbbbbbbbbbbbbbbbbbbbbbbbbbbbbbbbbbbbbbbb"}],"implementation_status":{"source_evidence_delta":"VERIFIED","folder_snapshot_v1":"IMPLEMENTED_NOT_VERIFIED","passport_recreate":"NOT_IMPLEMENTED","passport_restore":"NOT_IMPLEMENTED","status_lookup":"VERIFIED"},"feature_flags":{"listing_suite.source_evidence_delta":"ON","listing_suite.folder_snapshot_v1":"OFF","listing_suite.passport_recreate":"OFF","listing_suite.passport_restore":"OFF"},"test_receipts":[{"test_receipt_id":"TEST-RECEIPT-DELTA-001","scope":"SOURCE_EVIDENCE_DELTA","sha256":"cccccccccccccccccccccccccccccccccccccccccccccccccccccccccccccccc"}],"secrets_embedded":false,"publication_authority":"NOT_GRANTED"}
