{"schema_version":"1.0","deployment_id":"LS-DEPLOYMENT-FIXTURE-OFF-001","environment":"TEST","deployed_at":"2026-10-04T13:00:00Z","deployed_by":"DEPLOYER-FIXTURE","adapter_version":"0.1.0","contract_bindings":[{"artifact_path":"Listing_Suite_Integration_Contract.md","artifact_version":"1.1","sha256":"aaaaaaaaaaaaaaaaaaaaaaaaaaaaaaaaaaaaaaaaaaaaaaaaaaaaaaaaaaaaaaaa"}],"implementation_status":{"source_evidence_delta":"IMPLEMENTED_NOT_VERIFIED","folder_snapshot_v1":"NOT_IMPLEMENTED","passport_recreate":"NOT_IMPLEMENTED","passport_restore":"NOT_IMPLEMENTED","status_lookup":"IMPLEMENTED_NOT_VERIFIED"},"feature_flags":{"listing_suite.source_evidence_delta":"OFF","listing_suite.folder_snapshot_v1":"OFF","listing_suite.passport_recreate":"OFF","listing_suite.passport_restore":"OFF"},"test_receipts":[],"secrets_embedded":false,"publication_authority":"NOT_GRANTED"}
